{
  "$schema": "../../schema/resume.schema.json",
  "navigation": [
    {
      "label": "Experiences",
      "sectionId": "experience"
    },
    {
      "label": "Projects",
      "sectionId": "projects"
    },
    {
      "label": "Skills",
      "sectionId": "skills"
    },
    {
      "label": "Education",
      "sectionId": "education"
    },
    {
      "label": "Let’s Talk",
      "sectionId": "contact"
    }
  ],
  "profile": {
    "name": "Hamid R. Rezaei",
    "monogram": "hr",
    "headline": "Full-Stack Software Engineer",
    "summary": "I design and build Java/Spring services, secure APIs, data-intensive applications, and React interfaces. My work spans backend development, CI/CD automation, cloud infrastructure, and observability. I enjoy working through complex problems and making software easier to test, release, and support.",
    "location": "Toronto, Canada",
    "email": "dev.hamid.rezaei@gmail.com",
    "links": [
      {
        "label": "LinkedIn",
        "url": "https://www.linkedin.com/in/hamid-reza-rezaei-17896a125/"
      },
      {
        "label": "GitHub",
        "url": "https://github.com/HamidRezaRezaeiGitHub"
      }
    ]
  },
  "sections": {
    "experience": {
      "title": "Experiences"
    },
    "projects": {
      "title": "Projects"
    },
    "skills": {
      "title": "Skills",
      "eyebrow": "What I work with"
    },
    "education": {
      "title": "Education"
    },
    "contact": {
      "title": "Let’s Talk",
      "description": "I’m interested in backend, full-stack, and senior engineering roles. If you think we could work well together, I’d like to hear from you.",
      "emailLabel": "Send an email",
      "eyebrow": "Have a role or project in mind?"
    }
  },
  "experiences": [
    {
      "id": "hsbc-agency-lending",
      "title": "Full-Stack Engineer",
      "team": "Agency Securities Lending",
      "organization": "HSBC",
      "location": "Toronto, Canada",
      "startDate": "2025-06",
      "endDate": "present",
      "bullets": [
        {
          "id": "asl-services",
          "text": "Developing and maintaining Spring Boot (Java) microservices that expose REST APIs and integrate with other services."
        },
        {
          "id": "asl-analytics",
          "text": "Building SQL-based Looker Studio dashboards over BigQuery data for revenue and balance analysis, in partnership with product and business users."
        },
        {
          "id": "platform-poc",
          "text": "Co-architected a multi-service proof of concept that achieved 100% output parity with existing platforms for one selected trade type over a defined evaluation period; built an AD-backed authentication service, API gateway, and React frontend."
        },
        {
          "id": "ai-assistant",
          "text": "Designed and implemented a context-aware, in-product AI assistant using React and Spring AI."
        },
        {
          "id": "ai-enablement",
          "text": "Drove AI adoption across multiple teams by building an enterprise harness with script-backed skills for GitHub, Jira, Confluence, logs, and Jenkins, supported by training and knowledge-sharing sessions."
        },
        {
          "id": "asl-security",
          "text": "Implemented Spring Security and JWT authorization, using JPA with a cloud-hosted relational database."
        },
        {
          "id": "asl-delivery",
          "text": "Designed and led the migration from legacy scripts to Jenkins/Groovy CI/CD pipelines, automating builds, tests, Sonatype and Checkmarx scans, artifact versioning, Jira and Confluence integration, and deployments across environments."
        }
      ]
    },
    {
      "id": "hsbc-data-service-layer",
      "title": "Full-Stack Engineer",
      "team": "Data Service Layer",
      "organization": "HSBC",
      "location": "Toronto, Canada",
      "startDate": "2023-06",
      "endDate": "2025-06",
      "bullets": [
        {
          "id": "dsl-architecture",
          "text": "Owned architectural design, code reviews, and the delivery roadmap for a scalable data-transfer and synchronization product built on Spring Batch and modular development."
        },
        {
          "id": "dsl-etl",
          "text": "Contributed to a configurable, event-driven ETL application using Solace, Spring Integration (Java 21), and PostgreSQL, processing high-throughput real-time trading data while preserving lifecycle event order."
        },
        {
          "id": "dsl-reliability",
          "text": "Implemented message acknowledgments, retries, exception handling, and transactional controls to reduce the risk of data loss during concurrent processing."
        },
        {
          "id": "dsl-observability",
          "text": "Created parameterized Grafana dashboards to improve visibility into application health and performance."
        },
        {
          "id": "dsl-file-retrieval",
          "text": "Designed and owned a secure production file-retrieval application using React, Spring Boot, and Spring Security, guiding authorized users through locating and retrieving files while enforcing backend access controls."
        },
        {
          "id": "dsl-migration",
          "text": "Evaluated legacy functionality and designed scalable alternatives for phased migration."
        }
      ]
    },
    {
      "id": "hsbc-trade-reporting",
      "title": "Software Developer & DevOps Engineer",
      "team": "Trade Reporting Americas",
      "organization": "HSBC",
      "location": "Toronto, Canada",
      "startDate": "2021-04",
      "endDate": "2023-06",
      "bullets": [
        {
          "id": "trade-regression",
          "text": "Reduced regression analysis from one week to three hours by parallelizing datasets across Jenkins pipelines and aggregating results in a multithreaded Spring Boot application."
        },
        {
          "id": "trade-delivery",
          "text": "Created modular Jenkins/Groovy pipelines integrating GitHub, Maven, Nexus, Jira, Ansible, and ServiceNow for build, deployment, and change-management workflows."
        },
        {
          "id": "trade-regulatory",
          "text": "Delivered Java and Drools changes for CFTC, SEC, and Canadian regulatory reporting requirements."
        },
        {
          "id": "trade-maintenance",
          "text": "Refactored legacy applications using OOP and SOLID principles and automated production operations with Bash."
        },
        {
          "id": "trade-support",
          "text": "Supported L2/L3 incident diagnosis and resolution with an international agile team."
        }
      ]
    },
    {
      "id": "teaching",
      "title": "Computer Science & Mathematics Teacher",
      "organization": "Milad Taha",
      "location": "Tehran, Iran",
      "startDate": "2013-12",
      "endDate": "2018-12",
      "bullets": [
        {
          "id": "teaching-subjects",
          "text": "Taught programming, algorithms, flowcharts, Excel and macros, alongside algebra, combinatorics, probability, and geometry for grades 10–12."
        }
      ]
    }
  ],
  "projects": [
    {
      "id": "buildean",
      "title": "Buildean",
      "role": "Co-founder & Backend Engineer",
      "stage": "Beta",
      "startDate": "2025-06",
      "endDate": "present",
      "links": [
        {
          "label": "Visit Buildean",
          "url": "https://buildean.com/beta/"
        }
      ],
      "bullets": [
        {
          "id": "buildean-backend",
          "text": "Architected the Java 25/Spring Boot 4 backend for a construction-estimation platform, using PostgreSQL, Flyway, and modular REST/OpenAPI services."
        },
        {
          "id": "buildean-estimation",
          "text": "Built a transaction-safe estimation engine with hierarchical work scopes, quote resolution, manual overrides, scenario copying, and bidirectional task–estimate synchronization."
        },
        {
          "id": "buildean-delivery",
          "text": "Secured APIs with Firebase authentication, RBAC, and ownership controls; automated keyless GitHub Actions delivery to GCP Cloud Run and Cloud SQL across DEV and UAT."
        }
      ]
    },
    {
      "id": "buy-or-rent",
      "title": "BuyOrRent",
      "role": "Creator & Backend Engineer",
      "stage": "Live backend · Flutter frontend in progress",
      "startDate": "2025-09",
      "endDate": "present",
      "bullets": [
        {
          "id": "buy-or-rent-backend",
          "text": "Designed a TypeScript/Hono backend on Cloudflare Workers with shared financial-domain logic exposed through OpenAPI HTTP endpoints and MCP tools."
        },
        {
          "id": "buy-or-rent-projections",
          "text": "Implemented rent, loan, mortgage, property, investment, and expense projections using precise decimal arithmetic and explicit accrual, scheduling, and rounding policies."
        },
        {
          "id": "buy-or-rent-delivery",
          "text": "Built strict Zod contracts, consistent HTTP/MCP errors, and private R2-backed CSV exports, backed by GitHub Actions delivery across DEV, UAT, and PROD."
        }
      ]
    },
    {
      "id": "man-agent-ment",
      "title": "man-agent-ment",
      "role": "Creator",
      "stage": "Open-source developer-workflow kit",
      "startDate": "2026-04",
      "endDate": "present",
      "links": [
        {
          "label": "View on GitHub",
          "url": "https://github.com/HamidRezaRezaeiGitHub/man-agent-ment"
        }
      ],
      "bullets": [
        {
          "id": "man-agent-ment-toolkit",
          "text": "Built a portable POSIX-shell toolkit supporting Codex, Claude Code, Gemini CLI, and GitHub Copilot, with 60+ versioned workflows, skills, templates, scripts, and adapters."
        },
        {
          "id": "man-agent-ment-workflows",